"text","cmp_code","eu_code"
"Wir Freie Demokraten wollen einen fairen Schlüssel für die Verteilung von Flüchtlingen in Europa durchsetzen.","108",NA
"Um die Flüchtlingskrise zu meistern, braucht es die Beteiligung aller EU-Mitgliedstaaten.","108",NA
"Deswegen fordern wir, die Dublin-III-Verordnung durch einen fairen Verteilungsschlüssel zu ersetzen.","108",NA
"Flüchtlinge mit Bleibeperspektive müssen nach verbindlichen Quoten verteilt werden.","108",NA
"Zur Berechnung der Quoten sind Bevölkerungsstärke und Wirtschaftskraft eines Landes maßgeblich.","108",NA
"Bei der individuellen Entscheidung müssen auch Kriterien wie familiäre Bindung oder Sprachkenntnisse berücksichtigt werden.","108",NA
"Länder, die sich dieser Art der Solidarität verweigern, sollen in einen Fonds einzahlen müssen.","108",NA
"Der Fonds soll wiederum Aufnahme- und Grenzstaaten außerhalb der EU bei der Bewältigung der Flüchtlingskrise finanziell unterstützen.","108",NA
"Europäisch abgestimmte Entwicklungszusammenarbeit","H",NA
"Wir Freie Demokraten setzen uns für eine europäisch abgestimmte, effektive und wirksame Entwicklungszusammenarbeit ein, die auf Qualität der eingesetzten Mittel setzt statt auf deren Quantität.","108",NA
"Dabei legen wir Wert auf eine bessere Differenzierung bei der Auswahl der Partnerländer.","107",NA
"Es muss verstärkt auf die Kriterien Bedarf, Leistungsfähigkeit, Entwicklungsbereitschaft und Effizienz der Maßnahmen geachtet werden.","107",NA
"Nötig sind neue Kooperationen zur Integration der deutschen und lokalen Privatwirtschaft und Entwicklungspartnerschaften mit neu en Gebern.","107",NA
"Wir fordern kohärentere Ansätze innerhalb der Bundesregierung und der Europäischen Union, insbesondere zwischen Wirtschafts-, Außen-, Handels- und Entwicklungspolitik sowie in Abstimmung mit der europäischen Entwicklungszusammenarbeit.","108",NA
"Hierzu gehört auch eine Überprüfung der Auswirkungen der AgrarExport-Subventionen.","107",NA
"Zusätzlich ist eine abgestimmte Außen-, Sicherheits-, Handels-, und Entwicklungspolitik nötig, die verstärkt auf Krisenprävention und Konfliktbewältigung als wichtigstes Mittel zur Bekämpfung von Fluchtursachen setzt.","107",NA
"Europa bleibt unsere Zukunft","H",NA
"Wir Freie Demokraten sind überzeugte Europäer.","108",NA
"Denn die Geschichte hat gezeigt, in welche Sackgassen aggressiver Nationalismus führt.","108",NA
"Das europäische Projekt hat unserem Kontinent Frieden und Wohlstand gebracht.","108",NA
"Doch kann niemand übersehen, dass einzelne Teile heute noch nicht perfekt sind.","108",NA
"Daher lasst uns Europa stärker machen, indem wir seine Schwächen beheben!","108",NA
"Reformen für eine bessere EU","H",NA
"Wir Freie Demokraten fordern institutionelle Reformen für mehr Transparenz und Effizienz in der EU.","108",NA
"Das Europäische Parlament soll nach einem einheitlichen Wahlrecht mit staatenübergreifenden Listen und Spitzenkandidaten gewählt werden.","108",NA
"Es muss zu einem Vollparlament mit Initiativrecht aufgewertet werden.","108",NA
"Ein Sitz in Brüssel ist dabei ausreichend.","108",NA
"Das spart Zeit und Geld im Vergleich zum Parallelbetrieb zwischen zwei Parlamentssitzen.","108",NA
"Die EU-Kommission kann auf 16 Kommissare verkleinert werden.","108",NA
"Hierbei sollten klare und einfach zurechenbare Ressorts vergeben werden, die den EU-Zuständigkeiten entsprechen.","108",NA
"Ferner soll sich die Kommission nur um die Dinge kümmern, die besser auf europäischer Ebene geregelt werden und den Rest den nationalen Ebenen überlassen.","108",NA
"Der Rat der Europäischen Union muss sich zu einer modernen zweiten Kammer entwickeln.","108",NA
"Dort kann jeder Mitgliedstaat seine Position öffentlich vortragen.","108",NA
"Mit diesen Reformen schaffen wir Transparenz und Effizienz, die wichtigsten Bausteine für eine gelungene Integration.","108",NA
"Zu einer starken Gemeinschaft gehört es, das Subsidiaritätsprinzip in der EU zu wahren.","108",NA
"Deshalb sind die Vorschläge der Europäischen Kommission zu einer sozialen Säule Europas nicht zielführend.","108",NA
"Wir sprechen uns hier nachdrücklich gegen eine Einflussnahme der Europäischen Union im Rahmen von verpflichtenden Rechtsakten aus.","108",NA
"Jeder Mitgliedsstaat muss nach wie vor für seine eigene Arbeitsmarktpolitik, sein soziales Sicherungssystem und seine finanzielle Unterstützung sozial Schwacher selbst verantwortlich bleiben.","108",NA
"Deshalb erteilen wir insbesondere einer gemeinsamen europäischen Arbeitslosenversicherung eine klare Absage.","108",NA
"Europa der verschiedenen Geschwindigkeiten","H",NA
"Wir Freie Demokraten möchten, dass die europäische Integration durch ein „Europa der verschiedenen Geschwindigkeiten“ vereinfacht wird.","108",NA
"Auch nach dem Brexit mit zukünftig 27 Mitgliedstaaten bleibt die europäische Integration angesichts der Vielfalt und Unterschiedlichkeiten der Mitgliedstaaten ein schwieriger Prozess.","108",NA
"Deshalb möchten wir differenzierte Möglichkeiten für unterschiedliche Tiefen und Geschwindigkeiten bei der weiteren Integration schaffen.","108",NA
"Mitgliedstaaten, die an der Weiterentwicklung der EU nicht oder nur langsamer teilnehmen wollen, sollen die anderen nicht aufhalten.","108",NA
"Wenn weitere Schritte der europäischen Integration nicht von allen Mitgliedstaaten mitgetragen werden, wollen wir mehr Gebrauch von den Möglichkeiten der „Verstärkten Zusammenarbeit“ machen, um die Integration mit unterschiedlichen Geschwindigkeiten voranzutreiben.","108",NA
"Deshalb muss das Projekt der Europäischen Staatsanwaltschaft nun endlich abgeschlossen und schnell umgesetzt werden.","108",NA
"Damit weitere Staaten später stufenweise aufschließen können, soll ihnen ein Nachholen der vorangegangenen Integrationsschritte ermöglicht werden.","108",NA
"Wir sind davon überzeugt, dass der europäische Einigungsprozess fortgesetzt werden muss, hin zu einer dezentral und bundesstaatlich verfassten Europäischen Union.","108",NA
"Dieser Weg ist das erklärte Gegenmodell zum Rückfall Europas in nationalstaatliche Kleinstaaterei einerseits oder die Schaffung eines zentralisierten europäischen Superstaats andererseits.","108",NA
"Effektiver Schutz der EU-Außengrenzen","H",NA
"Wir Freie Demokraten wollen einen effektiven Schutz der EU-Außengrenzen.","108",NA
"Nur so können wir wirksam kontrollieren, wer in die EU einreist und gleichzeitig die Grenzen zwischen den EU-Mitgliedstaaten offenhalten.","108",NA
"Die Grenzagentur FRONTEX soll von der jetzigen zwischenstaatlichen Struktur zu einem echten europäischen Grenzschutz mit eigener Handlungsbefugnis und Kontrolle durch das Europäische Parlament ausgebaut werden.","108",NA
"Sie braucht zentrale Führung, genügend schlagkräftiges Einsatzpersonal und modernste Überwachungs- und Reaktionsmittel.","605.1",NA
"Wie alle EU-Akteure ist FRONTEX an die Europäische Charta der Grundfreiheiten gebunden, denn innere Sicherheit in Europa darf nie auf Kosten der Menschenrechte erzielt werden.","201.2",NA
"Daher soll sie auch Aufgaben der Hochseenotrettung im Mittelmeer wahrnehmen, um weitere Tote durch kenternde Schlepper-boote zu verhindern.","201.2",NA
"Echte Gemeinsame Außen- und Sicherheitspolitik in Europa","H",NA
"Wir Freie Demokraten wollen eine echte Gemeinsame Außen- und Sicherheitspolitik (GASP) in Europa.","108",NA
"Wir stehen zum Ziel, dass Europa gemeinsam Verantwortung für Frieden, Freiheit und Sicherheit trägt und wollen die GASP der EU stärken.","108",NA
"Nur wenn wir in Fragen globaler Abkommen geeint auftreten, wird die europäische Stimme Gewicht erlangen.","108",NA
"Der Hohen Vertreterin der EU für Außen- und Sicherheitspolitik sollte dabei eine Schlüsselposition als „EU-Außenministerin“ zukommen.","108",NA
"Nur wenn es uns gelingt, auch in den strittigen Fragen im passenden Moment eine europäische Antwort zu geben, wird man uns als Friedensmacht ernst nehmen.","108",NA
"Deswegen setzen wir uns für einen konsequenten Ausbau der gemeinsamen Fähigkeiten ein, auch abseits der Europäischen Verträge.","108",NA
"Einzelne EU-Staaten sollten im Rahmen der verstärkten Zusammenarbeit gemeinsam handeln können, wenn es ihre Fähigkeiten und Sicherheit erhöht.","108",NA
"Vielmehr sollen auch einzelne EU-Staaten zusammenarbeiten, wenn es ihre Fähigkeiten und Sicherheit erhöht.","108",NA
"Nutzung europäischer Synergien bei Rüstungsentwicklung und –beschaffung","H",NA
"Wir Freie Demokraten wollen mehr europäische Synergien für die Rüstungsentwicklung und -beschaffung.","108",NA
"Rüstungsentwicklung und -beschaffung ist nicht nur politisch hochbrisant, sondern auch extrem kostspielig.","105",NA
"Um Geld zu sparen und die europäische Partnerschaft zu vertiefen, soll es auch für die Rüstungsindustrie einen funktionierenden Binnenmarkt mit einheitlichen Beschaffungsregeln geben.","108",NA
"Arbeiten die Mitgliedsländer zusammen, muss Geld nicht durch jedes Land einzeln ausgegeben werden, sondern es reicht die einmalige und zentrale Investition.","108",NA
"Verwenden die europäischen Armeen die gleiche Ausrüstung, können in folgenden Schritten die gemeinsame Ausbildung und militärische Integration weiter vorangetrieben werden.","108",NA
"Die Europäische Union braucht eine Europäische Armee","H",NA
"Wir Freie Demokraten wollen den Aufbau einer Europäischen Armee unter gemeinsamem Oberbefehl und parlamentarischer Kontrolle.","108",NA
"Dazu streben wir schrittweise eine engere Verzahnung und den Ausbau der gemeinsamen Fähigkeiten der Streitkräfte der integrationswilligen Mitgliedsländer an und damit die Schaffung einer Europäischen Verteidigungsunion.","108",NA
"Der erste Schritt hierzu wäre die Nutzung des im EU-Vertrag bereits vorhandenen Instruments der Ständigen Strukturierten Zusammenarbeit in Verteidigungsfragen.","108",NA
"Die Aufstellung europäischer, multinationaler Verbände gehört dazu","108",NA
"ebenso wie eine schrittweise integrierte gemeinsame militärische Ausrüstung.","104",NA
"So können Kosten optimiert und technische und taktische Kompatibilität erhöht werden.","108",NA
"Es gilt, Strategien, Ausbildung und Einsatzverfahren anzugleichen und auf EU-Ebene zu integrieren.","108",NA
"Ein gemeinsames Hauptquartier könnte aus den Stabselementen der fünf bereits bestehenden supranationalen Korps hervorgehen.","108",NA
"Bei all diesen Schritten muss parallel die Interoperabilität mit Kräften und Instrumenten der NATO weiter verstärkt werden.","107",NA
"Nur gemeinsam kann die EU auch in Zukunft Sicherheit für ihre Bürgerinnen und Bürger garantieren, insbesondere angesichts eines Präsidenten Trump, der das Verhalten der USA zunehmend unvorhersehbar macht.","108",NA
"Menschenrechte gelten weltweit","H",NA
"Menschenrechte gelten weltweit, doch sieht die Realität in vielen Ländern der Welt immer noch anders aus.","201.2",NA
"Freiheit","201.1",NA
"und Menschenrechte sind aber Grundprinzipien, die nicht an Grenzen haltmachen.","201.2",NA
"Fordern wir sie ein!","201.1",NA
"Universalität der Menschenrechte","H",NA
"Wir Freie Demokraten bekennen uns zur Universalität der Menschenrechte und lehnen jegliche Versuche ab, ihre Anwendbarkeit zu relativieren.","201.2",NA
"Wir wenden uns gegen jede Diskriminierung aufgrund von Geschlecht, Religion, Hautfarbe, ethnischer Herkunft, sexueller Orientierung, Behinderung, Alter oder eines sonstigen Status.","201.2",NA
"Die Unterdrückung oder Angriffe auf andere Menschen und Bevölkerungsgruppen sind stets Angriffe auf die Freiheit der ganzen Gesellschaft.","201.1",NA
"So treten wir entschlossen der Diskriminierung von Lesben, Schwulen, Bisexuellen, Transgender und Intersexuellen in der Außen- und Entwicklungspolitik entgegen","107",NA
"und setzen uns dafür ein, LGBTI-Projekte weltweit zu fördern und bei Strafverschärfungen gegen LGBTI die Entwicklungszusammenarbeit zu kürzen.","503",NA
"Werteorientierte Entwicklungspolitik","H",NA
"Wir Freie Demokraten fordern eine werteorientierte Entwicklungspolitik, die auf Qualität statt auf Quantität der eingesetzten Mittel setzt,","107",NA
"und einen besonderen Fokus auf Rechtsstaatlichkeit, gute Regierungsführung und Soziale Marktwirtschaft hat.","202.1",NA
"Die Grundlagen unseres Handelns sind dabei die Nachhaltigkeitsagenda 2030 der Vereinten Nationen und das Pariser Klimaabkommen.","416.2",NA
"Eine zügige Umsetzung der Agenda 2030 erfordert einen kohärenten Ansatz innerhalb der Bundesregierung","416.2",NA
"insbesondere zwischen Wirtschafts-, Außen- und Entwicklungspolitik sowie in Abstimmung mit der Europäischen Entwicklungszusammenarbeit.","108",NA
"Dazu setzen wir Freie Demokraten auf neue Partnerschaften und Kooperationen mit allen relevanten Partnern, insbesondere mit der Privatwirtschaft.","416.2",NA
"Es gilt dabei, die am wenigsten entwickelten Länder in den Blick zu nehmen, vor allen Dingen auf dem Chancenkontinent Afrika.","107",NA
"Die wichtigste Grundlage für die Armutsbekämpfung sind Bildung, Ausbildung und Qualifikation genauso wie die Chance auf eine wirtschaftliche Perspektive für den Einzelnen.","107",NA
"Die Möglichkeiten, die sich durch Innovationen, Digitalisierung und neue Technologien bieten, müssen wir für Entwicklungsländer stärker in den Fokus nehmen und fördern.","411",NA
"Maßnahmen gegen Grund- und Menschenrechtsverletzungen in der EU","H",NA
"Wir Freie Demokraten setzen uns für Maßnahmen gegen EU-Staaten ein, die dauerhaft Grund- und Menschenrechte verletzen.","201.2",NA
"Wir beobachten die innenpolitischen Entwicklungen in einigen EU-Staaten mit Sorge.","201.2",NA
"Wer die verfassungsmäßige Gewaltenteilung in Frage stellt, greift den Rechtsstaat in seinem Fundament an.","202.1",NA
"Wer die politische Kontrolle der Medien verschärft, zeigt, dass er von Meinungs- und Pressefreiheit wenig hält.","202.1",NA
"Die EU ist auf gemeinsame Werte wie Rechtsstaatlichkeit, Menschenrechte und Demokratie gestützt, die gemäß Artikel 2 des Vertrags über die Europäische Union für jedes Mitglied verbindlich sind.","202.1",NA
"Wir setzen uns für eine Reform der Rechtsstaatskontrolle ein, um bei dauerhaften Verletzungen unserer Werte auch unterhalb der Schwelle des Stimmentzugs wirksame Sanktionen verhängen zu können.","108",NA
"Denn nur, wenn wir selbst von der Wirkungskraft unserer Werte überzeugt sind und ihnen bei Gegenwind Geltung verschaffen, stärken wir Europa als Wertegemeinschaft.","108",NA
"Weltweite Anerkennung des Internationalen Strafgerichtshofs","H",NA
"Wir Freie Demokraten setzen uns für die weltweite Anerkennung des Internationalen Strafgerichtshofs (IStGH) ein.","107",NA
"Der IStGH ist bei schwersten Menschenrechtsverletzungen zuständig, sofern die Strafverfolgung im eigenen Land nicht willens oder nicht in der Lage ist, die Verbrechen vor Gericht zu bringen.","201.2",NA
"Zahlreiche Länder haben die Statuten des Gerichtshofes nicht unterzeichnet oder ratifiziert, unterlaufen die Gerichtsbarkeit oder kündigten gar ihre Mitgliedschaft aus politischen Gründen wieder auf.","107",NA
"Als Freie Demokraten unterstützen wir mit Nachdruck seine Arbeit und Stärkung.","107",NA
"Nur durch ihn können auch einzelne Amtsträger konsequent zur Verantwortung gezogen werden","107",NA
"und rechtsstaatliche Prinzipien weltweit zur Anwendung kommen.","202.1",NA
"Entschiedene Bekämpfung von Terror","H",NA
"Internationaler Terrorismus gefährdet weltweit Freiheit und Menschenrechte.","107",NA
"Dem muss sich Deutschland mit seinen Partnern entschlossen entgegenstellen.","107",NA
"Seien wir standhaft!","107",NA
"Bessere internationale Kooperation zur Terrorismusbekämpfung","H",NA
"Wir Freie Demokraten wollen eine bessere internationale Kooperation zur Terrorismusbekämpfung.","107",NA
"Der internationale Terrorismus macht nicht vor Ländergrenzen halt und ist das Problem der gesamten Staatengemeinschaft.","107",NA
"Daher ist es auch nicht nur Aufgabe weniger Länder, dieser Bedrohung entgegenzutreten.","107",NA
"Die internationale Gemeinschaft muss hier zusammenstehen.","107",NA
"Der für die Terrorabwehr notwendige Datenaustausch und die konsequente Zusammenarbeit der Geheimdienste muss deshalb organisiert werden.","107",NA
"Außerdem sind die europäischen Gremien wie Europol und das Amt des Anti-Terror-Koordinators der Union aufzuwerten.","108",NA
"Europol soll zu diesem Zweck zu einer EU-Bundespolizei ausgebaut und ein EU-Nachrichtendienst gegründet werden, welche beide dem EU-Parlament gegenüber rechenschaftspflichtig sind.","108",NA
"Zudem muss durch eine Stärkung von Eurojust die Kooperation auf der Ebene der Staatsanwaltschaften und Gerichte gestärkt werden, um auch schneller und effektiver zu Urteilen kommen zu können.","108",NA
"Nur so kann der Rechtsstaat klare Antworten geben.","108",NA
"Wichtig ist, dass ein Austausch nicht zur anlasslosen und verdachtsunabhängigen Überwachung aller EU-Bürgerinnen und EU-Bürger missbraucht wird.","201.1",NA
"Eine Verschärfung des deutschen Waffenrechts lehnen wir ab, weil sie nicht mehr Sicherheit bringt.","201.1",NA
"Es geht darum, die Rechte aller Bürgerinnen und Bürger zu schützen.","201.1",NA
"Bekämpfung des islamistischen Terrorismus","H",NA
"Wir Freie Demokraten haben erkannt, dass der Kampf gegen den internationalen islamistischen Terrorismus wie gegen den sogenannten Islamischen Staat und Al-Qaida eine globale Herausforderung darstellt.","107",NA
"Um dieser Bedrohungslage entschlossen entgegenzutreten, ist es notwendig, eng mit ausländischen Nachrichtendiensten zu kooperieren, die finanzielle Basis von Terrorgruppierungen zu zerschlagen","107",NA
"und an rechtlich legitimierten Militärmaßnahmen mitzuwirken.","104",NA
"Gleichzeitig müssen regionale Kräfte, die sich gegen islamistische Terrorgruppierungen stellen, gestärkt","107",NA
"und mit Beratung, Ausbildung und Ausrüstung unterstützt werden.","104",NA
"Wirksame Maßnahmen gegen den radikalen Salafismus","H",NA
"Wir Freie Demokraten fordern wirksame Maßnahmen gegen den radikalen Salafismus, einer ultrakonservativen Glaubensrichtung innerhalb des Islams.","202.1",NA
"Dabei setzen wir auch auf die Kooperation mit all jenen Musliminnen und Muslimen und entsprechenden Verbänden, die Intoleranz, Gewalt und religiösen Extremismus bekämpfen wollen.","202.1",NA
"Unser Ziel ist ein flächendeckendes Vorgehen, das Repression und Prävention vereint.","202.1",NA
"Voraussetzung ist eine intensivere Beobachtung gewaltbereiter salafistischer Extremisten durch den Verfassungsschutz.","605.1",NA
"Auf Grundlage der erzielten Erkenntnisse muss alles rechtlich Mögliche unternommen werden, um salafistische Bestrebungen effektiv zu unterbinden: Versammlungs- und Vereinsverbote, konsequente Strafverfolgung, Aus- und Wiedereinreisebeschränkungen für Gefährder sowie deren gezielte Überwachung, beispielsweise mittels elektronischer Fußfessel.","605.1",NA
"Um der Radikalisierung junger Menschen entgegenzuwirken, darf salafistischer Propaganda kein Raum bleiben.","202.1",NA
"Deshalb braucht es eine umfassende Prävention in Schulen, Moscheen, Jugendzentren, aber auch in Internetforen und sozialen Netzwerken.","202.1",NA
"Die bisherigen Bemühungen und Investitionen sind dafür bei Weitem nicht ausreichend.","202.1",NA
"Insbesondere im Bereich der sozialen Medien muss mehr Aufklärungsarbeit geleistet werden, welche die jungen Menschen niedrigschwellig erreicht.","202.1",NA
"Der sogenannte Islamische Staat investiert ein Vielfaches dessen, was der Staat an Gegenmaßnahmen ergreift.","202.1",NA
"Die Ausbildung von Multiplikatoren und Fachkräften zur Erkennung und Verhinderung der Radikalisierung muss verstärkt werden.","202.1",NA
"Ein weiterer wichtiger Baustein ist die Einbindung geläuterter Rückkehrer und Aussteiger in die Aufklärungsarbeit.","202.1",NA
"Sie können authentisch von ihren Erlebnissen, den falschen Versprechungen und der Realität im Islamischen Staat berichten.","202.1",NA
"Auch die mittlerweile zahlreichen betroffenen Eltern radikalisierter junger Menschen sollten in die Aufklärungsarbeit einbezogen werden.","202.1",NA
"Mit besseren Bildungschancen und einer stärkeren Wertevermittlung kann dem Salafismus ebenfalls der Nährboden entzogen werden.","506",NA
"Sicherheitspolitik mit Augenmaß","H",NA
"Freiheit und Menschenrechte lassen sich nicht immer friedlich verteidigen.","106",NA
"Gewaltanwendung muss immer das letztmögliche Mittel in engsten Grenzen sein, wenn alles andere bereits versucht wurde.","106",NA
"Stellen wir das sicher!","106",NA
"Parlamentsvorbehalt für gemeinsame EU- und NATO-Einsätze weiterentwickeln","H",NA
"Für uns Freie Demokraten ist und bleibt die Bundeswehr eine Parlamentsarmee.","104",NA
"Das Parlamentsbeteiligungsgesetz hat sich zur Schaffung von Rechtssicherheit bei bewaffneten Einsätzen der Bundeswehr im Ausland bewährt.","104",NA
"Im Lichte der angestrebten verstärkten Schaffung gemeinsamer EU- und NATO-Einsatzkräfte wollen wir den Parlamentsvorbehalt des Deutschen Bundestags unter voller Berücksichtigung der Maßgaben des Bundesverfassungsgerichts so weiterentwickeln, dass gemeinsame Einsätze multinationaler Verbände von EU und NATO verfassungsfest erleichtert werden.","104",NA
"Modernisierung der Bundeswehr","H",NA
"Wir Freie Demokraten setzen uns für eine moderne Bundeswehr mit einsatzorientierten Strukturen ein, die sowohl zur Bündnis- und Landesverteidigung wie für internationale Einsätze befähigt ist.","104",NA
"Dazu muss die Bundeswehr besser ausgestattet werden.","104",NA
"Die Prozesse zur Beschaffung neuer Ausrüstungsgegenstände gehören grundsätzlich auf den Prüfstand.","104",NA
"Die Vergangenheit hat immer wieder gezeigt, dass es bei größeren Projekten qualitative, terminliche und kostentechnische Mängel gegeben hat.","104",NA
"Der Modernisierungsprozess der Bundeswehr muss weiter vorangetrieben und den neuen Anforderungen angepasst werden.","104",NA
"Dabei wollen wir auch die Attraktivität des militärischen Dienstes steigern.","104",NA
"Denn die Bundeswehr steht im Wettbewerb mit anderen Arbeitgebern um die besten Bewerberinnen und Bewerber.","104",NA
"Um den Personalbedarf weiterhin zu decken und junge Menschen für den anspruchsvollen Dienst zu gewinnen, muss die Attraktivität des Dienstes kontinuierlich verbessert werden.","104",NA
"Entscheidende Faktoren sind dabei moderne und ausreichende Ausrüstung, Arbeitszeitbelastung, Weiterbildungsmöglichkeiten, Versetzungshäufigkeit, die Versorgung im Falle der Verwundung und nicht zuletzt die Vereinbarkeit von Familie und Dienst.","104",NA
"Keine Waffenlieferungen in Krisengebiete","H",NA
"Wir Freie Demokraten wollen keine Waffenlieferungen in Krisengebiete.","412",NA
"Denn Rüstungsexporte in Konfliktregionen können bereits instabile Regionen noch weiter destabilisieren.","412",NA
"Die Unsicherheit und Bedrohung für die Menschen in den betroffenen Gebieten wird hierdurch nachhaltig erhöht und die Chancen auf Friedens- und Konfliktlösungen können ebenfalls behindert werden.","106",NA
"Es sollte deshalb auch für die Zukunft Grundpfeiler deutscher Außenpolitik sein, Rüstungsexporte in Konfliktregionen auszuschließen.","106",NA
"Die Entscheidung über Rüstungsexporte soll auch weiterhin durch die Bundesregierung erfolgen als Teil ihrer exekutiven Kernaufgaben.","412",NA
"Jedoch fordern wir, dass ein Rüstungsexportgesetz die bestehenden nationalen, europäischen und internationalen Exportrichtlinien deutlich präzisiert und dadurch zu mehr Transparenz im Regierungshandeln und zu besserer Beteiligung des Deutschen Bundestags führt.","202.1",NA
"Politik, die rechnen kann","H",NA
"Politik muss gestalten.","000",NA
"Aber sie ist kein Wunschkonzert.","000",NA
"Die Dinge müssen so angepackt werden, dass sie funktionieren und finanzierbar sind.","000",NA
"Kurz: Wir brauchen eine Politik, die rechnen kann.","000",NA
"Gemessen daran, laufen viele Dinge in Deutschland aus dem Ruder: Die Belastung der Bürger mit Steuern und Abgaben ist in Deutschland nicht nur höher als anderswo, sondern steigt weiterhin an – und das, obwohl der Staat immer mehr Geld zur Verfügung hat.","505",NA
"Wir wollen, dass der Staat mit dem Geld der Bürger sparsamer umgeht.","505",NA
"Wir wollen, dass er es cleverer investiert als bislang.","403",NA
"Wir wollen eine neue Balance zwischen den Einnahmen der Bürger und den Einnahmen des Staates herstellen.","503",NA
"Faire Balance zwischen Bürger und Staat","H",NA
"Eine Politik, die rechnen kann, achtet auf eine faire Balance zwischen den Belastungen der Bürgerinnen und Bürger und den Einnahmen des Staates.","503",NA
"Hier ist in Deutschland einiges aus dem Gleichgewicht geraten.","503",NA
"Stellen wir die Balance wieder her!","503",NA
"Fairer Anteil der Bürgerinnen und Bürger am Wachstum","H",NA
"Wir Freie Demokraten wollen, dass die Bürgerinnen und Bürger wieder einen fairen Anteil an den Wachstums- und Wohlstandsgewinnen haben.","503",NA
"Seit über zehn Jahren ist die Steuer- und Abgabenquote kontinuierlich angewachsen.","505",NA
"Zwischen Bürgerinnen und Bürgern und dem Staat öffnet sich eine gewaltige Schere: Das Lohnniveau stieg von 2005 bis 2015 gerade mal um 23 Prozent.","505",NA
"Das Steueraufkommen von Bund, Ländern und Gemeinden erhöhte sich dagegen im gleichen Zeitraum um fast 50 Prozent.","505",NA
"Mit hohen Steuern in Zeiten niedriger Zinsen treibt die Politik einen Keil zwischen Bürgerinnen und Bürger und den Staat.","505",NA
"Das führt insbesondere zur Enteignung der Mittelschicht","704",NA
"und der Bezieher der kleineren Einkommen.","701",NA
"Deshalb wollen wir ein grundlegendes Umdenken in der Steuerpolitik.","505",NA
"Von Wachstums- und Wohlstandsgewinnen darf nicht allein der Staat profitieren.","409",NA
"Wir wollen die Balance zwischen Privat und Staat wiederherstellen und deshalb die übermäßige Umverteilung von Privat zu Staat beenden.","409",NA
