"text","cmp_code","eu_code"
"Vor allem in der Schule ist zu vermitteln, warum und wie es zu diesen Diktaturen kommen konnte, um die nachwachsenden Bürgerinnen und Bürger aktuelle und zukünftige Entwicklungen in diese Richtungen erkennen zu lassen.","202.1",NA
"Wir wollen das Stasi-Unterlagen-Archiv zu einem modernen, nutzerfreundlichen Archiv in den Strukturen des Bundesarchivs machen, welches den Zugang zu den Akten für Opfer und Wissenschaftler langfristig sichert und erleichtert.","202.1",NA
"Das Amt des Bundesbeauftragten möchten wir, insbesondere in seiner Bedeutung für die Opfer der SED-Diktatur, weiterentwickeln.","202.1",NA
"Moderne Landwirtschaft","H",NA
"Vorankommen durch eigene Leistung muss überall möglich sein, auf dem Land genauso wie in der Stadt.","703.1",NA
"50 Prozent der Bevölkerung lebt auf dem Land.","703.1",NA
"Zeit für vernünftige Politik, die Artenvielfalt und artgerechte Tierhaltung sichert und dabei Land- und Forstwirtschaft unterstützt statt behindert!","703.1",NA
"Selbstbestimmung von Landwirten","H",NA
"Wir Freie Demokraten fördern landwirtschaftliche Unternehmerinnen und Unternehmer, die selbstbestimmt und sachkundig ihrer Arbeit nachgehen können.","703.1",NA
"Daher setzen wir uns für ein praktikables und bewegliches Düngerecht ein.","703.1",NA
"Der Grundsatz einer bedarfs- und standortgerechten Nährstoffversorgung der landwirtschaftlichen Kulturen bleibt für uns auch in Zukunft der Maßstab der Düngung.","703.1",NA
"Landwirtinnen und Landwirte müssen in der Lage bleiben, nach Entzug und Bilanz zu düngen.","703.1",NA
"Die Umsetzung des Nationalen Aktionsplans zur nachhaltigen Anwendung von Pflanzenschutzmitteln wollen wir ohne Abstriche vorantreiben.","416.2",NA
"Denn eine ausreichende Verfügbarkeit von verschiedenen Mitteln für den Pflanzenschutz und den Vorratsschutz ist im Sinne einer verlässlichen Versorgung mit Nahrungsmitteln unverzichtbar.","703.1",NA
"Bei öffentlichen Diskussionen über bestimmte Wirkstoffe zählen für uns nicht Stimmungen, sondern nachvollziehbare Fakten und nicht zuletzt die Stellungnahmen des Bundesinstitutes für Risikobewertung.","703.1",NA
"Mit neuen Forschungsrichtungen der Grünen Biotechnologie wie dem „Genome-Editing“ wollen wir offen und transparent umgehen.","411",NA
"Wir lehnen pauschalisierende Verbote ab und fordern stattdessen eine faktenbasierte, ergebnisoffene Bewertung neuer Technologien.","411",NA
"Große Chancen sehen wir zudem in digitalen Innovationen für die Landwirtschaft:","411",NA
"Wenn sich beispielsweise über Sensoren der Nährstoffgehalt im Boden messen lässt und mittels Drohnen eine punktgenaue Düngung und Schädlingsbekämpfung möglich wird, können Landwirtinnen und Landwirte den Einsatz von Dünge- und Pflanzenschutzmitteln beispielsweise viel spezifischer steuern.","703.1",NA
"Sicherung der nachhaltigen Forstwirtschaft","H",NA
"Wir Freie Demokraten wollen die Zukunft der nachhaltigen Forstwirtschaft mit ihren vielfältigen Funktionen für Wirtschaft, Ökologie und Naherholung sichern.","416.2",NA
"Die Bundeswaldinventur, welche Waldbestände und deren Zustand in Deutschland erfasst, zeigt: Der deutsche Wald wird naturnah bewirtschaftet.","501",NA
"Daher verdienen Kommunal- und Privatwaldbesitzer eine Politik, die es ihnen einfach macht.","501",NA
"Deshalb wollen wir im Sinne eines Gemeinwohlausgleichs die Förderung im Rahmen der Gemeinschaftsaufgabe Agrarstruktur und Küstenschutz fortführen und zur Stärkung des Kleinprivatwaldes forstwirtschaftliche Zusammenschlüsse unterstützen.","703.1",NA
"Die Nutzung des klimafreundlichen Rohstoffes Holz wollen wir durch ein gezieltes Innovations- und Forschungsprogramm voranbringen.","416.2",NA
"Mit Blick auf eine verlässliche Versorgung mit dem Rohstoff Holz, gehört das Ziel der nationalen Strategie zur biologischen Vielfalt, fünf Prozent der deutschen Waldfläche aus der forstwirtschaftlichen Nutzung zu nehmen und sich selbst zu überlassen, auf den Prüfstand.","416.2",NA
"Denn Artenschutz und eine nachhaltige Waldbewirtschaftung in Verbindung mit Alt- und Totholzkonzepten, sowie weiteren Maßnahmen des Vertragsnaturschutzes, schließen sich keineswegs aus.","416.2",NA
"Sicherung der Artenvielfalt","H",NA
"Wir Freie Demokraten wollen die Zukunft der Artenvielfalt sichern.","501",NA
"Dabei setzen wir bevorzugt auf  freiwillige Maßnahmen und den eigentumsfreundlichen Vertragsnaturschutz.","401",NA
"In diesem Sinne planen wir, die Bundesprogramme „Biologische Vielfalt“ und „Wiedervernetzung“, die in unserer Regierungszeit aufgelegt wurden, weiter auszubauen, um Lebensräume zu erhalten und miteinander zu verbinden.","501",NA
"Das Jagdrecht soll weiterhin Vertrauen in die Sachkunde und das selbstbestimmte Handeln von Jägerinnen und Jägern setzen sowie das Recht am Grundeigentum achten.","201.1",NA
"Neben den berechtigten Interessen einer naturnahen Waldbewirtschaftung und der dafür notwendigen Regulierung der Wildbestände wollen wir auch zum Schutz gesunder Populationen räuberische und invasive Arten kontrollieren.","416.2",NA
"Eine Ausweitung der sachlichen Verbote im Bundesjagdgesetz lehnen wir daher strikt ab.","401",NA
"Wir wollen eine Fischerei, welche die Bestände erhält und den Natur- und Tierschutz sichert.","501",NA
"Dazu soll die Grundschleppnetz-Fischerei beschränkt werden.","501",NA
"Allgemeine Angelverbote für die Freizeitfischerei (zum Beispiel in Natura-2000-Gebieten in der Ausschließlichen Wirtschaftszone der Nord- und Ostsee) halten wir indes für unverhältnismäßig.","201.1",NA
"Das Grundnahrungsmittel Fisch ist durch die Überfischung der Meere gefährdet.","501",NA
"Wir sehen in einer modernen und nachhaltig wirtschaftenden Aquakultur einen Schlüssel zur Lösung dieses Problems.","416.2",NA
"Deshalb sollen die Rahmenbedingungen für solche Aquakulturen entbürokratisiert werden.","416.2",NA
"Artgerechte Tierhaltung und Tierernährung","H",NA
"Wir Freie Demokraten setzen uns für eine artgerechte Tierhaltung und Tierernährung ein.","501",NA
"Wünschenswerte Verbesserungen bei der Nutztierhaltung wollen wir durch eine gezielte Agrarinvestitionsförderung erreichen.","501",NA
"Starre ordnungsrechtliche Vorgaben oder zu ehrgeizige TierwohlZertifizierungen überfordern hingegen vor allem kleine Landwirtschaftsbetriebe und beschleunigen somit den Strukturwandel.","703.1",NA
"Beim Schutz von Heimtieren gilt für uns der Grundsatz „Lenken statt Verbieten“.","501",NA
"In diesem Sinne wollen wir die Sachkunde von Heimtierhaltenden verbessern.","501",NA
"Modelle wie Positiv- und Negativlisten, welche die Haltung bestimmter Arten untersagen, lehnen wir entschieden ab.","501",NA
"Denn sie führen lediglich zu einer Kriminalisierung von Tierhaltenden und zu einem grauen Markt, der einen wirksamen Tierschutz letztlich nur erschwert.","501",NA
"Wir wollen den Flickenteppich der Kormoranverordnungen in Deutschland harmonisieren und eine bundesweite Strategie zur Regulierung der Bestände auf den Weg bringen.","501",NA
"Wir brauchen ein Populationsmanagement für den Kormoran, das den Artenschutz im Blick hat und den Interessen der Menschen dient.","501",NA
"Moderner Umweltschutz","H",NA
"Vorankommen durch eigene Leistung bedeutet verantwortungsbewusstes Handeln für sich und seine natürliche Umgebung.","201.1",NA
"Der weit verbreiteten Symbol- und Verbotspolitik setzen wir Fortschrittsoptimismus durch Freiheit und Verantwortung entgegen.","201.1",NA
"Gleichzeitig setzen wir auf den Schutz natürlicher Ressourcen.","501",NA
"Innovative Kreislaufwirtschaft","H",NA
"Wir Freie Demokraten wollen die Rahmenbedingungen für eine innovative Kreislauf- und Ressourcenwirtschaft verbessern und setzen verstärkt auf Müllvermeidung und Recycling.","501",NA
"Das marktwirtschaftliche Prinzip der Produktverantwortung, bei dem der Hersteller eines Produkts die Verantwortung für dessen spätere Entsorgung trägt, muss weiter gestärkt werden.","401",NA
"Im Gegensatz zum allgemeinen Trend, wieder nach einer stärkeren Rolle der Kreise und Kommunen zu rufen, vertrauen wir vor allem auf die Effizienz und die Wettbewerbsfähigkeit der privaten Entsorgungsunternehmen.","401",NA
"Blaues Wachstum","H",NA
"Wir Freie Demokraten setzen auf „blaues“ Wachstum, weil Ökologie und Wachstum sich nicht ausschließen müssen.","416.2",NA
"Wir wollen Klima, Umwelt und Ressourcen intelligent schützen – durch innovative Technologien und effektive Produktionsprozesse.","416.2",NA
"Es geht nicht nur darum, weniger wegzuwerfen, sondern mehr wiederzuverwenden.","416.2",NA
"Das eröffnet auch Schwellenländern bessere Chancen.","416.2",NA
"Meeresverschmutzung bekämpfen","H",NA
"Wir Freie Demokraten setzen uns dafür ein, dem internationalen Problem von Plastikmüll in den Meeren zu begegnen.","501",NA
"Dazu ist es nötig, mit internationalen Partnern Richtlinien und Anreize zu schaffen, die diesem Zweck dienen, aber auch die Einhaltung bereits bestehender Gesetze konsequenter zu verfolgen.","501",NA
"Es bedarf regionaler und globaler Anstrengungen, um die Verschmutzung unserer Meere zu verringern.","501",NA
"Dafür ist auch eine ständige aktive Zusammenarbeit der zuständigen Behörden weltweit nötig.","501",NA
"Außerdem müssen illegale Schiffsmüllentsorgungen viel stärker geahndet werden.","501",NA
"Schutz des Wassers","H",NA
"Die Freien Demokraten stehen für den Schutz des wichtigsten Lebensmittels, des Wassers.","501",NA
"Vor allem der Schutz des Grundwassers ist dafür existentiell.","501",NA
"Deshalb müssen Einträge (z.B. Rückstände aus Landwirtschaft, Industrie, Bergbau sowie Medikamente) immer dort reduziert werden, wo eine Gefährdung vorliegt.","501",NA
"Es gilt das Verursacherprinzip.","501",NA
"Flexible Altersvorsorge für moderne Erwerbsbiografien","H",NA
"Vorankommen durch eigene Leistung bedeutet, das Leben selbst in die Hand zu nehmen.","201.1",NA
"Dazu gehört nicht nur, den Menschen ihre Wahlmöglichkeiten zu lassen, damit sie selbstbestimmt ihre eigene Erwerbsbiographie schreiben können.","201.1",NA
"Dazu gehört auch, ihnen mehr Möglichkeiten zu geben, ihre Altersvorsorge und ihren Ruhestand flexibel an ihren Lebensweg anzupassen.","201.1",NA
"Werden wir flexibel!","201.1",NA
"Flexiblerer Übergang in den Ruhestand","H",NA
"Wir Freie Demokraten wollen allen Älteren einen flexiblen Übergang in den Ruhestand ermöglichen.","201.1",NA
"Dazu wollen wir ein politisch festgelegtes Renteneintrittsalter und die Hinzuverdienstgrenzen abschaffen.","201.1",NA
"Ob 63, 67 oder sogar 70 – starre Altersgrenzen für den Renteneintritt werden den verschiedenen Lebensentwürfen längst nicht mehr gerecht.","201.1",NA
"Gerade der flexible Renteneintritt schafft den notwendigen Freiraum für die Vereinbarkeit von Familie und Arbeit.","201.1",NA
"Viele Ältere sind heute länger fit und aktiv.","201.1",NA
"Sie wollen ihre Erfahrungen weitergeben oder sogar nochmal etwas Neues ausprobieren.","201.1",NA
"Andere wiederum können oder wollen im Alter nicht mehr arbeiten.","201.1",NA
"Daher soll künftig die einfache Regel gelten: Ab 60 entscheidet jeder selbst, wann er in Rente geht.","201.1",NA
"Wer früher in Rente geht, bekommt eine geringere, wer später geht, eine entsprechend höhere Rente.","201.1",NA
"Voraussetzung für den früheren Renteneintritt ist nur, dass das Einkommen aus gesetzlicher Rente und sonstiger Altersvorsorge über dem Grundsicherungsniveau liegt – also das Existenzminimum abgesichert ist.","504",NA
"In der Folge muss sichergestellt werden, dass die länger arbeitenden Älteren bei der Rentenbesteuerung nicht durch die Erhöhung des zu versteuernden Rentenanteils „bestraft“ werden.","503",NA
"Die Grundlagen für die gesetzliche Rente müssen im Osten und Westen unseres Landes gleich sein.","503",NA
"Die Höhe der Rente berechnet sich anhand der durchschnittlichen Lebenserwartung der jeweiligen Generation und kann sich über die Jahre verändern.","504",NA
"Dieser jahrgangsindividuelle Faktor sorgt für eine solide Finanzierung und einen fairen Ausgleich zwischen den Generationen.","503",NA
"Damit trägt jede Generation ihre eigenen Kosten und bürdet sie nicht den nachfolgenden Generationen auf.","503",NA
"Politische Eingriffe in die langfristige Rentenformel lehnen wir ab.","201.1",NA
"Dazu gehört auch eine sogenannte Rentengarantie.","504",NA
"Wer sich nicht gleich voll zur Ruhe setzen, sondern noch Teilzeit arbeiten möchte, soll es auch einfacher haben als heute.","201.1",NA
"Momentan müssen noch viele Menschen Rentenkürzungen hinnehmen, wenn sie Teilrente und Teilzeitarbeit kombinieren oder nach dem vollen Renteneintritt doch noch einmal wieder arbeiten wollen.","201.1",NA
"Das macht das Arbeiten im Alter für viele unattraktiv.","201.1",NA
"Deshalb wollen wir alle Hinzuverdienstgrenzen neben dem Rentenbezug abschaffen.","201.1",NA
"So kann jeder den Übergang in den Ruhestand so flexibel gestalten, wie er möchte.","201.1",NA
"Und auch die ständigen Diskussionen über die Anhebung des fixen Renteneintrittsalters erübrigen sich.","201.1",NA
"Unabhängig davon setzen wir uns für eine Stärkung der Erwerbsminderungsrenten ein.","504",NA
"Die aktuellen Änderungen der Bundesregierung sind keine wirksame Lösung.","504",NA
"Denn wer nach Jahren der Beitragszahlung durch einen Schicksalsschlag erwerbsunfähig wird, darf nicht zum Sozialfall werden.","504",NA
"Altersvorsorge nach dem Baukastenprinzip","H",NA
"Wir Freie Demokraten wollen die Altersvorsorge nach dem Baukastenprinzip organisieren.","201.1",NA
"Denn das Praktische an Bausteinen ist, dass man sie immer wieder neu und vielseitig kombinieren kann.","201.1",NA
"So kann sich jeder flexibel die Altersvorsorge zusammenstellen, die zu seinem Lebensweg passt.","201.1",NA
"Es muss ganz selbstverständlich werden, dass eine individuelle Kombination verschiedener Elemente das spätere Alterseinkommen ausmacht.","201.1",NA
"Es ist unumgänglich, das Rentenniveau in der gesetzlichen Rente daran anzupassen, dass die Menschen in Deutschland immer älter und zugleich weniger werden.","504",NA
"Als einzige Alternative zu drastisch steigenden Beitragssätzen ist die ergänzende Vorsorge unverzichtbar.","201.1",NA
"Betriebliche und private Altersvorsorge müssen daher attraktiver werden.","401",NA
"Zum Beispiel durch mehr Verbraucherfreundlichkeit und Vergleichbarkeit der Produkte.","403",NA
"Zudem sollte ergänzende Altersvorsorge auf eine breitere Basis gestellt werden.","403",NA
"Dazu sollte in allen Bereichen geförderter Altersvorsorge die Möglichkeit ausgeweitet werden, auch in Infrastruktur, Aktien und andere Unternehmensbeteiligungen zu investieren.","403",NA
"So könnte die Mitte der Gesellschaft auch stärker an den Chancen von Globalisierung und Digitalisierung teilhaben.","403",NA
"Unser Berufsleben wird zudem immer bunter.","505",NA
"Gerade in der digitalen Arbeitswelt warten viele neue Tätigkeitsfelder und Geschäftsideen.","505",NA
"Daher wird sich auch die berufliche Situation vieler Menschen häufiger verändern.","505",NA
"Sie können öfter zwischen Anstellung und Selbstständigkeit, Voll- und Teilzeit sowie In- und Ausland wechseln.","505",NA
"All das muss ohne Nachteile für die eigene Alterssicherung möglich sein.","505",NA
"Wer etwa aus der Anstellung in die Selbstständigkeit wechseln will, darf nicht benachteiligt werden, sondern muss zum Beispiel seine Riester-Förderung im „Rentenbaukasten“ behalten können.","403",NA
"Diese soll daher künftig ganz einfach allen zur Verfügung stehen.","403",NA
"Wir Freie Demokraten wollen die berufsständischen Versorgungswerke und die Möglichkeit zur Gründung weiterer Versorgungswerke dauerhaft erhalten.","504",NA
"Zunehmend sind ehemalige Selbstständige auf Leistungen der Grundsicherung angewiesen, für die die Steuerzahlerinnen und Steuerzahler aufkommen müssen.","401",NA
"Um dieser Gefahr vorzubeugen, sollen Selbstständige künftig für eine Basisabsicherung im Alter vorsorgen.","401",NA
"Dies soll zu einer Absicherung oberhalb des Grundsicherungsniveaus führen.","504",NA
"Alle Selbstständigen, die nicht Pflichtmitglied in einem berufsspezifischen Alterssicherungssystem sind, sollen dabei die Freiheit haben, ihre Vorsorgeform selbst zu wählen.","201.1",NA
"Zusätzlich zu dieser Wahlfreiheit wollen wir weitreichende Übergangsvorschriften und Karenzzeiten bei jeder Gründung schaffen.","403",NA
"Mehr Übersicht durch freiwilliges Vorsorgekonto","H",NA
"Wir Freie Demokraten wollen allen Bürgerinnen und Bürgern ein persönliches Vorsorgekonto anbieten.","403",NA
"Es soll übersichtlich zusammenfassen, wie viel Rente man später aus gesetzlicher, betrieblicher und privater Vorsorge insgesamt erhält.","403",NA
"Wer möchte, kann sich dieses Konto ganz einfach online auf einem sicheren Bürgerportal einrichten.","411",NA
"Natürlich muss jeder dabei die Kontrolle über seine Daten behalten und sich auf höchste Schutzstandards verlassen können.","411",NA
"Wir meinen, dass ein solches Vorsorgekonto zu einer besseren und umfassenderen Altersvorsorge führt.","411",NA
"Denn wer ausreichend vorsorgen möchte, benötigt einen Überblick über alle Ansprüche, die er schon gesammelt hat.","411",NA
"Das standardisierte Vorsorgekonto macht das einfach: Mit ein paar Klicks kann so jeder schnell ermitteln, wie hoch sein Alterseinkommen aus allen Elementen seines „Rentenbaukastens“ ist.","411",NA
"Dadurch schafft das Konto jederzeit Transparenz und deckt mögliche Vorsorgelücken auf.","411",NA
"Betriebliche Altersvorsorge stärken","H",NA
"Wir Freie Demokraten wollen die betriebliche Altersvorsorge stärken.","504",NA
"Die Reform der derzeitigen Bundesregierung ist zu kurz gesprungen.","504",NA
"Sie beschränkt sich auf Unternehmen, die in einen Tarifvertrag einbezogen sind.","504",NA
"Damit wird es vielen Mitarbeiterinnen und Mitarbeitern gerade in kleinen und neu gegründeten Unternehmen weiter erschwert, eine betriebliche Altersvorsorge aufzubauen.","701",NA
"Die Vorteile der Reform, etwa die liberalisierten Anlagevorschriften und die Zuschüsse für Arbeitnehmer mit niedrigen Einkommen, sollen auf alle Beschäftigte aller Unternehmen ausgeweitet werden.","701",NA
"Die Auszahlung von Vorsorgeverträgen darf in der Kranken- und Pflegeversicherung nicht beitragspflichtig sein, weil dies eine unfaire Doppelbelastung darstellt.","503",NA
"Wir wollen eine solche Lösung für alle Konzepte der betrieblichen und privaten Altersvorsorge.","503",NA
"Dem Arbeitnehmer soll es ermöglicht werden, dass bei einem Wechsel des Arbeitgebers der neue Arbeitgeber in den bestehenden Vorsorgevertrag gegebenenfalls in neuer Höhe einzuzahlen hat.","701",NA
"Angesichts des inzwischen häufigeren Wechsels von Beschäftigungsverhältnissen, sollten Wartezeiten auf zwei Jahre beschränkt werden.","701",NA
"Betriebe, die den Arbeitnehmerinnen und Arbeitnehmern noch garantierte Direktzusagen geben, sollten für die bestehenden Pensionsverpflichtungen entlastet werden.","403",NA
"Dazu wollen wir den Berechnungszeitraum für den handelsrechtlichen Abzinsungssatz von zehn auf zwölf Jahre verlängern und die Bewertung der Pensionsrückstellungen in der Handels- und Steuerbilanz vereinheitlichen.","403",NA
"Denn die geltenden Regelungen führen angesichts der niedrigen Zinsen zu hohen Belastungen und einer ungerechten Besteuerung der Unternehmen, die es ihnen erschwert weiter Direktzusagen zur betrieblichen Altersvorsorge zu geben.","403",NA
"Verschärfend kommt hinzu, dass Pensionsrückstellungenen steuerlich nur bis zu der Höhe berücksichtigt werden, wie sie mit einem Marktzins von sechs Prozent zu bilden gewesen wären.","403",NA
"Somit können Unternehmen einen Teil ihrer handelsrechtlichen Pensionsrückstellungen steuerlich nicht geltend machen.","403",NA
"Der Staat bedient sich also auf Kosten der Unternehmen, indem er Scheingewinne besteuert.","403",NA
"Um dies künftig zu verhindern, wollen wir die steuer- und handelsrechtliche Bewertung von Pensionsrückstellungen angleichen.","403",NA
"Breitere Investitionsmöglichkeiten für Kapitalsammelstellen","H",NA
"Wir Freie Demokraten wollen es Lebensversicherern, Pensionskassen und Versorgungswerken ermöglichen, vermehrt und einfacher in Start-ups, Aktien oder Infrastrukturprojekte zu investieren.","402",NA
"Denn eine freiwillige private Altersvorsorge ist künftig unverzichtbar, um den Lebensstandard im Alter zu erhalten.","505",NA
"Die anhaltende Niedrigzinspolitik der Europäischen Zentralbank verringert jedoch deutlich die Renditen, da Versicherer, Pensionskassen und Versorgungswerke immer noch in ihren Anlagemöglichkeiten beschränkt sind und daher einen Großteil des von ihnen verwalteten Kapitals in festverzinslichen Wertpapieren anlegen.","505",NA
"Für Sparer und Sparerinnen wird die private Altersvorsorge dadurch unattraktiv.","505",NA
"Dabei könnten gerade bei langen Anlagezeiträumen, wie bei der Altersvorsorge, Aktien und alternative Anlageformen Chancen auf eine höhere Rendite bieten.","505",NA
"Der langfristige Planungshorizont erlaubt es, temporäre Marktschwankungen auszuhalten.","401",NA
"Lebensversicherer, Pensionskassen und Versorgungswerke sollen deshalb verstärkt in Aktien, Infrastrukturprojekte und Unternehmensbeteiligungen investieren können, hierbei ist das Aufsichtsrechts anzupassen.","401",NA
"Dies bietet zugleich die Chance, Kapital für neue Geschäftsideen oder für Deutschlands unterfinanzierte Infrastruktur zu mobilisieren.","401",NA
"Aktivierender Sozialstaat","H",NA
"Viele großartige Ideen, Produkte und Unternehmen sind entstanden, weil Menschen ihre Ziele und Träume verfolgt haben.","402",NA
"Andere Menschen haben Einschränkungen oder sind bei dem Versuch, in ihrem Leben voranzukommen, gestolpert.","402",NA
"Oftmals sind sie auf die Hilfe der Gesellschaft angewiesen, um einen neuen Anlauf zu nehmen.","402",NA
"Diese Hilfe unkompliziert und fair zu leisten, ist in einer offenen Gesellschaft selbstverständlich.","402",NA
"Der Sozialstaat der Gegenwart jedoch ist bürokratisch, unübersichtlich und teuer.","303",NA
"Helfen wir lieber fair, transparent und unkompliziert!","303",NA
"Das Versprechen, im Wandel durch Weiterbildung mithalten zu können","H",NA
"Wir Freie Demokraten setzen auf das Versprechen, dass alle Bürgerinnen und Bürger durch Weiterbildung beim digitalen Wandel auch mithalten können.","411",NA
"Die Digitalisierung verändert unser Leben – und prägt die Arbeitswelt von morgen.","411",NA
"Wie bei den großen Umbrüchen in der Vergangenheit wird uns auch diesmal die Arbeit nicht ausgehen.","411",NA
"Zahlreiche Jobs werden sich stark verändern, manchen Beruf wird es in Zukunft vielleicht gar nicht mehr geben – genauso werden aber viele neue Jobs entstehen, die wir uns heute noch gar nicht vorstellen können.","411",NA
"Die Welle der digitalen Gründungen zeigt uns schon heute, welche großen Jobpotenziale bestehen.","411",NA
"Aber im Wandel müssen die Menschen durch gute Rahmenbedingungen und Qualifizierung begleitet werden, denn der Weiterbildungsbedarf ist und wird gewaltig sein.","411",NA
"Wir brauchen das Versprechen an alle Bürgerinnen und Bürger, beim digitalen Wandel auch mithalten zu können.","411",NA
"Deshalb muss lebenslanges Lernen noch stärker vom Schlagwort in gelebte Realität münden.","411",NA
"So können Aufstiegschancen verbessert","503",NA
"und das Risiko von Arbeitslosigkeit vermieden werden.","701",NA
"Immer mehr Betriebe unterstützen die Weiterbildung ihrer Mitarbeiterinnen und Mitarbeiter – aber für Zweidrittel der Beschäftigten bleibt hier noch viel zu tun.","701",NA
"Deshalb muss auch die Arbeitsmarktpolitik die Weiterbildung von Beschäftigten stärker unterstützen.","701",NA
"So sollten sinnvolle Weiterbildungsmaßnahmen im Rahmen des bestehenden Budgets der BA grundsätzlich auch für alle Betriebe mit maximal 50 Prozent gefördert werden können – unbürokratisch, bedarfsgerecht und am Markt orientiert.","701",NA
"Wir wollen nicht mehr Geld ausgeben, sondern bei jedem Euro fragen, ob er nicht besser in Qualifikation als in Transferzahlungen investiert werden kann.","701",NA
"Um alle Bürgerinnen und Bürger unabhängig von ihrer Beschäftigung fortlaufend bei Investitionen in ihre eigene Weiterbildung zu unterstützen, muss darüber hinaus ähnlich dem Bausparen ein einfaches und unbürokratisches Modell für Bildungssparen steuerlich gefördert werden.","701",NA
"Zweite Chance – Unterstützung zum (Wieder-) Einstieg","H",NA
"Für uns Freie Demokraten sind der Wille zum Erfolg und der Mut zum Scheitern zwei Seiten einer Medaille.","503",NA
"Deshalb wollen wir jedem Menschen eine zweite Chance ermöglichen, wenn er wirtschaftlich oder persönlich gescheitert ist.","503",NA
"Ein Scheitern oder das Drohen desselben kann viele Gründe haben: die Entwertung von Qualifikationen im Strukturwandel, unternehmerischer Misserfolg, das Scheitern privater Lebensentwürfe, Krankheit oder längerfristige Arbeitslosigkeit.","503",NA
"Wir wollen jeden befähigen, immer wieder einzusteigen.","503",NA
"Wer erwerbsfähig ist und die Teilhabe an Arbeit verloren hat, sollte nicht dauerhaft alimentiert werden, sondern Hilfe zu einer erneuten Chance auf Teilhabe erhalten.","503",NA
"Dies ist eine zentrale Frage von Fairness.","503",NA
"Ziel muss es immer sein, schnellstmöglich wieder den Einstieg in einen Job zu finden.","701",NA
"Und wenn es aufgrund der persönlichen Situation sinnvoll ist, die Arbeitslosigkeit als Gelegenheit zur besseren Qualifikation zu nutzen, ist das richtig – und heute mit dem „Arbeitslosengeld Weiterbildung“ auch schon vollständig möglich.","701",NA
"Eine Verlängerung der Bezugsdauer von ALG I ist hingegen kontraproduktiv.","701",NA
"Denn nur wer den Wiedereinstieg in den Arbeitsmarkt geschafft hat, kann auch aufsteigen und vorankommen.","701",NA
